category_name,resource_name,formats,department,division,tags,redistribution_allowed,commercial_use_allowed,provider,tel,description,comment,year,month,day,repeat_rule_frequency,repeat_rule_interval,repeat_rule_description
土地・気象,鳥取県のダムの概要,HTML,県土整備部,河川課,報告書,true,true,鳥取県,0857-26-7379,ダム諸元,"",,,,,,
土地・気象,鳥取県の海岸の概要,HTML,県土整備部,河川課,非定型,true,true,鳥取県,0857-26-7379,海岸延長、海岸保全区域延長,"",,,,,,
土地・気象,鳥取県のボーリングデータ情報,XML,県土整備部,技術企画課,位置,true,true,鳥取県,0857-26-7499,鳥取県県土整備部が実施したボーリングをデータを提供しています。,（独）防災科学技術研究所のポータルサイト「ジオ・ステーション（Geo-Station）」にて公開している関係上、鳥取県の地盤情報について、原則自由利用できますが、「ジオ・ステーション（Geo-Station）利用規約」、「鳥取県地盤情報利用規約」によるものとし、「鳥取県オープンデータカタログ（試行版）利用規約」より優先するものとします。,,,,,,
土地・気象,鳥取県の河川の概要,PDF,県土整備部,河川課,非定型,true,true,鳥取県,0857-26-7374,水系数、河川数、延長,"",2004,4,,,,
農林水産業,まき網漁業と小型いかつり漁業の漁獲量,PDF,農林水産部,水産試験場,統計,true,true,鳥取県,0859-45-4500,アジ・サバ・イワシ類・ブリ類、スルメイカの漁獲量,"",2014,9,,yearly,,毎年
農林水産業,境漁港のベニズワイガニの漁獲量・漁獲金額,XLS,農林水産部,水産試験場,統計,true,true,鳥取県,0859-45-4500,境漁港のベニズワイの漁獲量と金額,"",2013,,,yearly,,毎年
農林水産業,ズワイガニの水揚げ状況,PDF,農林水産部,水産課,統計,true,true,鳥取県,0857-26-7313,漁獲状況、出漁隻数、漁獲量・金額の推移,"",2013,,,yearly,,毎年
農林水産業,漁業センサス,XLS,地域振興部,統計課,統計,true,true,鳥取県,0857-26-7104,漁業経営体数、個人漁業経営体数、従事者数、漁船隻数等,"",2013,,,yearly,5,5年毎
農林水産業,鳥取県林業統計,PDF,農林水産部,森林・林業振興局,統計,true,true,鳥取県,0857-26-7301,林野面積・蓄積、造林等面積、林産物生産量等,"",2013,,,fiscal_yearly,,毎年度
農林水産業,鳥取県　農林水産業の概要,PDF,農林水産部,とっとり農業戦略課,統計,true,true,鳥取県,0857-26-7256,自然的条件、農業の概要、農家及び農業従事者、農地とその利用、農業生産、農家経済、林業、水産業,"",2014,,,fiscal_yearly,,毎年度
農林水産業,漁港別漁船数,XLS,県土整備部,空港港湾課,統計,true,true,鳥取県,0857-26-7405,漁港別登録漁船数、漁港別利用漁船数,"",2006,,,yearly,,毎年
農林水産業,境港の年別まき網水揚量,HTML,農林水産部,水産試験場,統計,true,true,鳥取県,0859-45-4500,アジ・サバ・イワシ類・ブリ類の年別漁獲量,"",2013,,,yearly,,毎年
農林水産業,ハタハタの漁獲量・漁獲金額,XLS,農林水産部,水産試験場,統計,true,true,鳥取県,0859-45-4500,鳥取県のハタハタの漁獲量と金額,"",2010,,,monthly,,毎月
農林水産業,農林業センサス,XLS,地域振興部,統計課,統計,true,true,鳥取県,0857-26-7104,農家数、農家人口、総林家数等,"",2010,,,yearly,5,5年毎
その他,オープンデータカタログ一覧,CSV,総務部,情報政策課,非定型,true,true,鳥取県,0857-26-7613,鳥取県オープンデータカタログサイトに掲載されているデータ一覧,2014.12.18時点,2015,2,,,,
その他,鳥取県少子化対策等に関するアンケート,PDF,福祉保健部,子育て応援課,統計,true,true,鳥取県,0857-26-7148,理想的な子どもの数、子育ての負担感、子育ての環境、仕事と子育てとの両立、少子化の理由,"",2013,,,yearly,3,3年毎
その他,公共施設情報（官公庁情報）,LINKED-RDF CSV,総務部,情報政策課,位置,true,true,鳥取県,0857-26-7614,公共施設情報（官公庁情報）一覧,とっとりWEBマップに掲載されている位置情報をCSV形式で出力したものを掲載しています。また、試験的にjig.jp社のオープンデータプラットフォームにてLinked-RDF形式での提供を行っています。,2014,9,,unscheduled,,不定期
その他,鳥取県人権意識調査,PDF,総務部,人権・同和対策課,報告書,true,true,鳥取県,0857-26-7590,人権、部落差別・結婚問題、女性の人権、障害者の人権、子どもの人権、高齢者の人権、外国人の人権、個人のプライバシー、病気にかかわる人の人権,"",2005,2,,,,
その他,鳥取県男女共同参画意識調査,PDF,地域振興部,男女共同参画推進課,統計,true,true,鳥取県,0857-26-7075,男女の平等感、性別役割分担意識、家事分担状況等、男女共同参画に関する県民のかたの意識,"",2011,,,yearly,5,5年毎
その他,鳥取県青少年育成意識調査,PDF,福祉保健部,青少年・家庭課,報告書,true,true,鳥取県,0857-26-7687,青少年の人間関係や非行などへの考え方や実態、家庭・学校・地域に対する青少年の考え方,"",2006,11,,,,
その他,山間集落実態調査,PDF,地域振興部,とっとり暮らし支援課,統計,true,true,鳥取県,0857-26-7129,山間集落の人口、世帯、高齢化率、定住の意向、災害時の不安、防犯対策への不安、日常生活の状況,"",2010,10,,,,
その他,県有施設情報,CSV,総務部,財源確保推進課,位置,true,true,鳥取県,0857-26-7016,とっとりWEBマップ（県有施設一覧）,"",2014,9,,unscheduled,,不定期
その他,携帯電話フィルタリングサービス実態調査,PDF,福祉保健部,青少年・家庭課,報告書,true,true,鳥取県,0857-26-7687,利用者への確認状況、フィルタリングサービスの説明・勧奨、加入状況,"",2009,3,,,,
その他,鳥取県男女共同参画マップ,PDF,地域振興部,男女共同参画推進課,統計,true,true,鳥取県,0857-26-7075,マップ、男女共同参画、県内の取組状況、推進体制、議会議員、審議会委員、役員,"",2014,,,fiscal_yearly,,毎年度
